455,National Microbial Pathogen Data Resource,http://www.nmpdr.org/,"National Microbial Pathogen Data Resource. A manually curated database of annotated genome data for the pathogens Campylobacter, Chlamydia, Chlamydophila, Haemophilus, Listeria, Mycoplasma, Neisseria, Staphylococcus, Streptococcus, Treponema, Ureaplasma, and Vibrio.",Online DB,,Devesh Khandelwal,
456,RegulonDB,http://regulondb.ccg.unam.mx/,RegulonDB is a model of the complex regulation of transcription initiation or regulatory network of the cell E. coli K-12.,Online DB,,Devesh Khandelwal,
457,Repbase,http://www.girinst.org/repbase/,Repbase is the most commonly used database for repetitive elements (transposons).,Online DB,,Devesh Khandelwal,
458,Saccharomyces Genome Database,http://www.yeastgenome.org/,"The Saccharomyces Genome Database is a scientific database of the molecular biology and genetics of the yeast Saccharomyces cerevisiae, which is commonly known as baker's or budding yeast.",Online DB,,Devesh Khandelwal,
459,Viral Bioinformatics Resource Center,http://www.biovirus.org/,Curated database containing annotated genome data for eleven virus families.,Online DB,,Devesh Khandelwal,
460,SEED,http://www.theseed.org/,"The SEED platform for microbial genome analysis includes all complete microbial genomes, and most partial genomes. The platform is used to annotate microbial genomes using subsystems.",Online DB,,Devesh Khandelwal,
461,Xenbase,http://www.xenbase.org,"Xenbase is a model organism database, providing informatics resources, genomic and biological data on the frogs, Xenopus laevis and Xenopus tropicalis.",Online DB,,Devesh Khandelwal,
462,WormBase,http://www.wormbase.org/,WormBase is an online biological database about the biology and genome of the nematode model organism Caenorhabditis elegans and contains information about other related nematodes.,Online DB,,Devesh Khandelwal,
463,Zebrafish Information Network,http://zfin.org,The Zebrafish Information Network (ZFIN) is an online biological database of information about the zebrafish (Danio rerio).,Online DB,,Devesh Khandelwal,
464,TAIR,http://arabidopsis.org,The Arabidopsis Information Resource (TAIR) maintains a database of genetic and molecular biology data for the model higher plant Arabidopsis thaliana.,Online DB,,Devesh Khandelwal,
465,UCSC Malaria Genome Browser,http://areslab.ucsc.edu/,"UCSC Malaria Genome Browser[1] is a bioinformatic research tool to study the malaria genome, developed by Hughes Undergraduate Research Laboratory together with the laboratory of Prof. Manuel Ares Jr. at the University of California, Santa Cruz.",Online DB,,Devesh Khandelwal,
466,RGD Rat Genome Database,http://rgd.mcw.edu/,"The Rat Genome Database (RGD) is the premiere location for rat data including genomics, genetics, physiology and functional data.",Online DB,,Devesh Khandelwal,
467,INTEGRALL,http://integrall.bio.ua.pt/,The INTEGRALL database is a freely available tool developed in order to provide an easy access to integron’s DNA sequences and genetic arrangements.,Online DB,,Devesh Khandelwal,
468,Fourmidable ant genome database,http://www.antgenomes.org/,Fourmidable ant genome database provides ant genome blast search and sequence download.,Online DB,,Devesh Khandelwal,
469,VectorBase,https://www.vectorbase.org/,VectorBase is an NIAID Bioinformatics Resource Center dedicated to providing data to the scientific community for Invertebrate Vectors of Human Pathogens.,Online DB,,Devesh Khandelwal,
470,EzGenome,http://www.ezbiocloud.net/ezgenome,"EzGenome, comprehensive information about manually curated genome projects of prokaryotes (archaea and bacteria).",Online DB,,Devesh Khandelwal,
471,Banana Genome Hub,http://banana-genome.cirad.fr/,The Banana Genome Hub centralises databases of genetic and genomic data for the Musa acuminata crop Hub developed by Cirad and Bioversity International and supported by the South Green Bioinformatics platform.,Online DB,,Devesh Khandelwal,
472,UniProt,http://www.uniprot.org/,"UniProt is the universal protein resource, a central repository of protein data created by combining the Swiss-Prot, TrEMBL and PIR-PSD databases.",,,Devesh Khandelwal,
473,Protein Information Resource,http://pir.georgetown.edu/,"The Protein Information Resource (PIR), located at Georgetown University Medical Center (GUMC), is an integrated public bioinformatics resource to support genomic and proteomic research, and scientific studies.",,,Devesh Khandelwal,
474,PEDANT,http://pedant.gsf.de/,The pedant genome database provides exhaustive automatic analysis of genomic sequences by a large variety of bioinformatics tools.,,,Devesh Khandelwal,
475,PROSITE,http://prosite.expasy.org/,"PROSITE is a protein database.[1][2] It consists of entries describing the protein families, domains and functional sites as well as amino acid patterns and profiles in them.",,,Devesh Khandelwal,
476,Database of Interacting Proteins,http://dip.doe-mbi.ucla.edu/,The Database of Interacting Proteins (DIP) is a biological database which catalogs experimentally determined interactions between proteins.,,,Devesh Khandelwal,
477,Pfam,http://pfam.xfam.org/,Pfam is a database of protein families that includes their annotations and multiple sequence alignments generated using hidden Markov models.,,,Devesh Khandelwal,
478,PRINTS,http://www.bioinf.manchester.ac.uk/dbbrowser/PRINTS/,PRINTS is a compendium of protein fingerprints.,,,Devesh Khandelwal,
479,ProDom,http://prodom.prabi.fr/prodom/current/html/home.php,ProDom is a comprehensive set of protein domain families automatically generated from the UniProt Knowledge Database,,,Devesh Khandelwal,
480,SignalP,http://www.cbs.dtu.dk/services/SignalP/,"SignalP 4.1 server predicts the presence and location of signal peptide cleavage sites in amino acid sequences from different organisms: Gram-positive prokaryotes, Gram-negative prokaryotes, and eukaryotes.",,,Devesh Khandelwal,
481,SUPERFAMILY,http://supfam.org/SUPERFAMILY/,SUPERFAMILY is a database of structural and functional annotation for all proteins and genomes.,,,Devesh Khandelwal,
482,Annotation Clearing House,http://clearinghouse.nmpdr.org/aclh.cgi,A framework for comparing annotations of identical proteins.,,,Devesh Khandelwal,
483,InterPro,http://www.ebi.ac.uk/interpro/,InterPro provides functional analysis of proteins by classifying them into families and predicting domains and important sites.,,,Devesh Khandelwal,
484,PRIDE Archive,http://www.ebi.ac.uk/pride/archive/,"The PRIDE PRoteomics IDEntifications database is a centralized, standards compliant, public data repository for proteomics data, including protein and peptide identifications, post-translational modifications and supporting spectral evidence.",,,Devesh Khandelwal,
485,MitoMiner,http://mitominer.mrc-mbu.cam.ac.uk/,A mitochondrial proteomics database integrating large-scale experimental datasets from mass spectrometry and GFP studies for 12 species.,,,Devesh Khandelwal,
486,Gelmap,https://gelmap.de/,A public database of proteins identified on 2D gels,,,Devesh Khandelwal,
487,SCOP,http://scop.mrc-lmb.cam.ac.uk/scop/,Structural Classification of Proteins,,,Devesh Khandelwal,
488,CATH,http://www.cathdb.info/,CATH is a classification of protein structures downloaded from the Protein Data Bank.,,,Devesh Khandelwal,
489,PDBsum,http://www.ebi.ac.uk/pdbsum/,PDBsum is a pictorial database that provides an at-a-glance overview of the contents of each 3D structure deposited in the Protein Data Bank (PDB).,,,Devesh Khandelwal,
490,Swiss-model,http://swissmodel.expasy.org/,"SWISS-MODEL is a fully automated protein structure homology-modelling server, accessible via the ExPASy web server, or from the program DeepView (Swiss Pdb-Viewer).",,,Devesh Khandelwal,
491,ModBase,http://salilab.org/modweb,"ModBase is a database of annotated comparative protein structure models, containing models for more than 3.8 million unique protein sequences.",,,Devesh Khandelwal,
492,Protein Model Portal,http://proteinmodelportal.org/,"Meta database that combines several databases of protein structure models (Biozentrum, Basel, Switzerland)",,,Devesh Khandelwal,
493,Rfam,http://rfam.xfam.org/,"The Rfam database is a collection of RNA families, each represented by multiple sequence alignments, consensus secondary structures and covariance models (CMs).",,,Devesh Khandelwal,
494,MiRBase,http://www.mirbase.org/,miRBase is a biological database that acts as an archive of microRNA sequences and annotations.,,,Devesh Khandelwal,
495,snoRNAdb,http://lowelab.ucsc.edu/snoRNAdb/,"snoRNAdb, a database of snoRNAs",,,Devesh Khandelwal,
496,lncRNAdb,http://www.lncrnadb.org/,Database that provides comprehensive annotations of eukaryotic long non-coding RNAs (lncRNAs).,,,Devesh Khandelwal,
497,MONOCLdb,http://www.monocldb.org/,The MOuse NOnCode Lung database: Annotations and expression profiles of mouse long non-coding RNAs (lncRNAs) involved in Influenza and SARS-CoV infections.,,,Devesh Khandelwal,
498,piRNABank,http://pirnabank.ibab.ac.in/,"piRNABank is a web analysis system and resource, which provides comprehensive information on piRNAs in the widely studied mammals namely Human, Mouse, Rat, Zebrafish, Platypus and a fruit fly, Drosophila.",Online DB,,Devesh Khandelwal,Indian
499,GtRNAdb,http://gtrnadb.ucsc.edu/,This genomic tRNA database contains tRNA gene predictions made by the program tRNAscan-SE on complete or nearly complete genomes.,,,Devesh Khandelwal,
500,SILVA,http://www.arb-silva.de/,A comprehensive on-line resource for quality checked and aligned ribosomal RNA sequence data.,,,Devesh Khandelwal,"Applaudes please, 500 complete."
501,RDP,http://rdp.cme.msu.edu/,"RDP provides quality-controlled, aligned and annotated Bacterial and Archaeal 16S rRNA sequences, and Fungal 28S rRNA sequences, and a suite of analysis tools to the scientific community.",,,Devesh Khandelwal,
502,tmRDB,http://www.ag.auburn.edu/mirror/tmRDB/,"tmRDB (tmRNA Database) provides aligned, annotated and phylogenetically ordered sequences related to structure and function of tmRNP.",,,Devesh Khandelwal,
503,SRPDB,http://rth.dk/resources/rnp/SRPDB/,"SRPDB (Signal Recognition Particle Database) provides aligned, annotated and phylogenetically ordered sequences related to structure and function of SRP.",,,Devesh Khandelwal,
504,snoRNABase,https://www-snorna.biotoul.fr//,"snoRNABase, a comprehensive database of human H/ACA and C/D box snoRNAs.",,,Devesh Khandelwal,
505,Eurocarbdb,http://relax.organ.su.se/eurocarb/home.action,"EuroCarbDB was an EU-funded initiative for the creation of software and standards for the systematic collection of carbohydrate structures and their experimental data, which was discontinued in 2010 due to lack of funding.",,,Devesh Khandelwal,Discontinued
506,BioGRID,http://thebiogrid.org/,BioGRID is an online interaction repository with data compiled through comprehensive curation efforts.,,,Devesh Khandelwal,
507,Database of Interacting Proteins,http://dip.doe-mbi.ucla.edu/,"The DIPTM database catalogs experimentally determined interactions between proteins. It combines information from a variety of sources to create a single, consistent set of protein-protein interactions.",,,Devesh Khandelwal,
508,NetPro,http://www.molecularconnections.com/home/en/home/resources/case-studies/alzheimer-disease-netpro/,Probable interaction networks involved in pathology of Alzheimer’s disease: predicting targets and therapeutic agents-NetProTM based study.,,,Devesh Khandelwal,
509,STRING,http://string.embl.de/,Known and Predicted Protein-Protein Interactions,,,Devesh Khandelwal,
510,The Cell Collective,http://thecellcollective.org/,The Cell Collective technology allows laboratory scientists working in different areas of the cell to collectively integrate their knowledge and create large-scale virtual cells in a non-technical fashion.,,,Devesh Khandelwal,
511,MINT,http://mint.bio.uniroma2.it/,MINT focuses on experimentally verified protein-protein interactions mined from the scientific literature by expert curators.,,,Devesh Khandelwal,
512,iRefIndex,http://irefindex.org/,"iRefIndex: provides an index of protein interactions available in a number of primary interaction databases including BIND, BioGRID, CORUM, DIP, HPRD, InnateDB, IntAct, MatrixDB, MINT, MPact, MPIDB, MPPI and OPHID.",,,Devesh Khandelwal,
513,RBPDB,http://rbpdb.ccbr.utoronto.ca//,The RNA-binding Proteins Database (RBPDB) is a biological database of RNA-binding protein specificities that includes experimental observations of RNA-binding sites.,,,Devesh Khandelwal,
514,LIMS,http://www.limsource.com/,Laboratory Information Management Systems. Compendium of information on state-of-the-art data management software.,,,Devesh Khandelwal,
515,MCID Core,http://www.mcid.co.uk/software/mcid_core/,"Image analysis software solutions for neuroscience, biology and other life sciences.",,,Devesh Khandelwal,
516,MetaSystems,http://metasystems.de/,Manufacturer of automatic microscopy imaging systems for research and routine labs.,,,Devesh Khandelwal,
517,Argo,http://www.broad.mit.edu/annotation/argo/,Software developed by the Broad Institute for visualizing and manually annotating whole genomes.,Free for research and educational users,,Devesh Khandelwal,
518,Blue Tractor Software,http://www.bluetractorsoftware.co.uk/,Java based commercial software for DNA and Protein sequence analysis.,Demo available.,,Devesh Khandelwal,
519,FinchTV,http://www.geospiza.com/finchtv/,Free DNA sequencing chromatogram trace viewer.,,,Devesh Khandelwal,
520,Ludesi,http://www.ludesi.com/,Analysis software and service for 2D electrophoresis gels as tools for multivariate statistical analysis.,,,Devesh Khandelwal,
521,MacVector,http://www.macvector.com/,"Macintosh software which provide sequence editing, primer design, database searching, protein analysis, alignment, phylogeny, and other functions.",,,Devesh Khandelwal,
522,SoftZymics,http://www.softzymics.com/,"Package for statistical analysis of steady-state enzyme kinetic data, and presentation graphics, for Macintosh or Windows based computers.",,,Devesh Khandelwal,
523,StarBiochem,http://web.mit.edu/star/biochem/,StarBiochem is an application that displays molecules from the Protein Data Bank.,,,Devesh Khandelwal,
524,AutoPrime,http://www.autoprime.de/AutoPrimeWeb,Automates generation of primers for RT-PCR experiments by combining the information from sequence databases with primer design software.,,,Devesh Khandelwal,
525,FastPCR,http://www.biocenter.helsinki.fi/bi/Programs/fastpcr.htm,"Free software for design of PCR primers, multiplex PCR, in silico PCR, clustering and any kind of repeat sequence.",,,Devesh Khandelwal,
526,Premierbiosoft,http://www.premierbiosoft.com/qpcr/index.html,Computer program used to screen SYBR Green primers and TaqMan probes for secondary structures such as dimers or hairpins.,,,Devesh Khandelwal,
527,EMBOSS,http://emboss.sourceforge.net/,The European Molecular Biology Open Software Suite. An open source project started by the EMBnet community in order to replace proprietary systems like GCG.,,,Devesh Khandelwal,
528,AnnHyb,http://bioinformatics.org/annhyb/,"Free software for working with and managing nucleotide sequences in multiple formats. Features include sequence annotation, restriction analysis, pattern searching, retrieval from servers.",,,Devesh Khandelwal,
529,BioEdit,http://www.mbio.ncsu.edu/BioEdit/bioedit.html,Free Windows biological sequence alignment editor.,,,Devesh Khandelwal,
530,BioMAJ,http://biomaj.genouest.org/,Workflow engine dedicated to bio-data synchronization and processing.,,,Devesh Khandelwal,
531,biOpen,http://www.lightwave-scientific.com/Resources/biOpen.pdf,Commercial Mac OS X sequence analysis and structure visualization software.,,,Devesh Khandelwal,
532,Darwin,http://cbrg.inf.ethz.ch/Darwin/index.html,An interactive tool for peptide and nucleotide sequence analysis.,,,Devesh Khandelwal,
533,DNPTrapper,http://dnptrapper.sourceforge.net/,A Linux assembly editing and visualization tool specifically designed for manual analysis and finishing of repeated regions.,,,Devesh Khandelwal,
534,Geneious,http://www.geneious.com/,This research software is designed for biologists and not computer scientists. It combines all the major DNA and protein sequence analysis tools into one software solution.,,,Devesh Khandelwal,
535,GeneRunner,http://www.generunner.net/,A fairly old Windows sequence analysis tool for everyday lab use. Formerly a commercial product.,,,Devesh Khandelwal,
536,GoCore,http://www.helsinki.fi/project/ritvos/GoCore/,"GoCore is a free Excel based tool for protein sequence alignment, comparisons and functional predictions in a simple, visually appealing, manner.",,,Devesh Khandelwal,
537,MELTING,http://www.ebi.ac.uk/~lenov/meltinghome.html,"Computes, for a nucleic acid duplex, the enthalpy, the entropy and the melting temperature of the helix-coil transitions.",,,Devesh Khandelwal,
538,Phrap/Consed,http://www.phrap.org/,DNA sequence assembler and finishing tools from the UW Genome Center.,,,Devesh Khandelwal,
539,SeWeR,http://bioinformatics.org/sewer/,An integrated portal for common web-based bioinformatics services. Built in Javascript as a standalone browser application.,,,Devesh Khandelwal,
540,XDigitize,http://www.molgen.mpg.de/~xdigitise/,A Linux/Unix visualization software system for evaluation of hybridisation experiments.,,,Devesh Khandelwal,
541,Amadeus,http://acgt.cs.tau.ac.il/amadeus/,"Platform for genome-scale detection of known and novel motifs (recurring patterns) in DNA sequences, applicable to a wide range of motif discovery tasks.",,,Ankit,
542,WebMOTIFS,http://fraenkel.mit.edu/webmotifs.html,"An online tool for motif discovery, scoring, analysis, and visualization.",,,Ankit,
543,FPat,http://www.ibc.wustl.edu/fpat,Search a molecular sequence database (proteins only) for patterns using simple regular expressions.,,,Ankit,
544,ELPH,http://cbcb.umd.edu/software/ELPH/,General-purpose Gibbs sampler for finding motifs in a set of DNA or protein sequences.,,,Ankit,
545,Motifs in protein databases,http://alces.med.umn.edu/dbmotif.html,Program determines if a protein motif is present in a database of protein sequences.,,,Ankit,
546,MatInspector,http://www.helmholtz-muenchen.de/cgi-bin/matsearch.pl,A tool for the detection of transcription factor binding sites,,,Ankit,
547,Genebee,http://www.genebee.msu.su/services/pat_reduced.html,This method of looking for all pattern entries in PROTEIN databank is almost the same as in PROSITE screening procedure.,,,Ankit,
548,SAM,http://bioweb2.pasteur.fr/,"SAM is a collection of software tools for creating, refining and using linear HMM for biological sequence analysis.",,,Ankit,
549,Predict Protien,https://www.predictprotein.org/,Service for sequence analysis and structure prediction.,,,Ankit,
550,BioProspector,http://robotics.stanford.edu/~xsliu/BioProspector/,Discovering Conserved DNA Motifs in Upstream Regulatory Regions of Co-Expressed Genes.,,,Ankit,
551,Compare Prospector,http://ai.stanford.edu/~iliu/CompareProspector/,Eukaryotic Regulatory Element Conservation Analysis and Identification Using Comparative Genomics.,,,Ankit,
552,YMF,http://abstract.cs.washington.edu/~saurabh/YMFWebRSH/YMFInput.pl,Yeast Motif Finder was developed for finding motifs in yeast promoters.,,,Ankit,
553,iTOL,http://itol.embl.de/,"Interactive Tree Of Life is an online tool for the display and manipulation of phylogenetic trees. It provides most of the features available in other tree viewers, and offers a novel circular tree layout, which makes it easy to visualize mid-sized trees (up to several thousand leaves).",NOT PAID,,kapil,
554,Phyogenetic tree (newick) viewer,http://etetoolkit.org/treeview/,"This is an online tool for phylogenetic tree view (newick format) that allows multiple sequence alignments to be shown together with the trees (fasta format). It uses the tree drawing engine implemented in the ETE toolkit, and offers transparent integration with the NCBI taxonomy database. Currently, alignments can be displayed in condensed or block-based format. Leaf names in the newick tree should match those in the fasta alignment.",nOT PAID,,kapil,
555,UGENE,http://ugene.unipro.ru/download.html,"Creating, editing and annotating nucleic acid and protein sequences",nOT PAID,,kapil,
556,tabix,http://ugene.unipro.ru/external.html,"Tabix is the first generic tool that indexes position sorted files in TAB-delimited formats such as GFF, BED, PSL, SAM and SQL export, and quickly retrieves features overlapping specified regions.",nOT PAID,,kapil,
557,VectorFriends,http://www.vectorfriends.com/downloads.html,"simulates the isothermal assembly with an intuitive interface and facilitates the design of primers by using Primer3, a de facto standard in molecular biology.",paid,,kapil,
558,Walrus,http://www.caida.org/tools/visualization/walrus/#download,"or interactively visualizing large directed graphs in
three-dimensional space. It is technically possible to display graphs
containing a million nodes or more, but visual clutter, occlusion, and
other factors can diminish the effectiveness of Walrus as the number of
nodes, or the degree of their connectivity, increases.",free,,kapil,
559,T-REX,http://trex.biohpc.org/labelfile.aspx,"T-RFLP data analysis requires many steps that are often time-intensive, error-prone, and can introduce unwanted variability into the analysis. T-REX is a free, online tool that was developed to address these obstacles.",free,,kapil,
560,HYPERTREE,http://kinase.com/tools/HyperTree.html#download,"is a Java phylogenetic tree viewer, with a hyperbolic ('fish-eye') view and editing abilities that help in managing very large trees.",free,,kapil,
561,The K tree score,,measures overall differences in the relative branch length and topology of two phylogenetic trees,,,,
562,OligoWalk,http://rna.urmc.rochester.edu/cgi-bin/server_exe/oligowalk/oligowalk_form.cgi, It can be used to design efficient siRNA targeting a given mRNA sequence.,Not paid,,Pragya,
563,PDB to 3D Restraints,http://rna.ucsc.edu/pdbrestraints/,"This Web-server generates custom RNA/DNA base stacking and base pairing restraints for crystallographic refinement. Input is in PDB format. Output is Pymol , CNS and PHENIX formatted.",Available to download. E-stack add-on module for CNS.,Centre for Molecular Biology of RNA,Pragya,
564,CNS,http://cns-online.org/v1.21/,"The program has been designed to provide a flexible multi-level hierachical approach for the most commonly used algorithms in macromolecular structure determination. Highlights include heavy atom searching, experimental phasing (including MAD and MIR), density modification, crystallographic refinement with maximum likelihood targets, and NMR structure calculation using NOEs, J-coupling, chemical shift, and dipolar coupling data.",Available to download.,,Pragya,
565,nuccyl,http://www.biosci.ki.se/groups/ljo/software/nuccyl.html,"nuccyl is a Perl program that allows PyMOL, a powerful open-source molecular modeling system, to display atomic models of nucleic acids in a highly simplified representation.",,,Pragya,
566,PyMOL,http://www.pymol.org/,"A molecular visualization system on an open source foundation, maintained and distributed by Schrödinger",Not Paid.Avaialable to download,,Pragya,
567,3DNA,http://x3dna.org/,"a suite of software programs for the analysis, rebuilding and visualization of 3-Dimensional Nucleic Acid structures",Free. Can be downloaded.,,Pragya,
568,PDB to pymol cone RNA Base Pairs,http://rna.ucsc.edu/rnabasepairs/,Input an RNA PDB file and estimated base pairings are output. Parameters and bond pair classes are from Saenger Classification Output is pymol oriented.,,,Pragya,
569,XRNA,http://rna.ucsc.edu/rnacenter/xrna/xrna.html,"XRNA is a Java based suite of tools for the creation, annotation and display of RNA secondary structure diagrams.",Can be installed.,,Pragya,
570,PseudoViewer,http://wilab.inha.ac.kr/pseudoviewer/,Visualizing RNA secondary structures and pseudoknot structures is essential to bioinformatics systems that deal with RNA structures.,Available for Download,,Pragya,
571,CEGeD,http://bibiserv.techfak.uni-bielefeld.de/ceged/webstart.html,"CEGeD computes the Inversion distance, the Translocation distance and the Double-Cut-and-Join distance of genomes. The genome data can be read from files or typed in manually in the program. The comparisons are shown as text and as graphic, and can be saved to files. CEGeD is an extension of the DCJ tool.",,,Pragya,
572,Gecko2,http://bibiserv.techfak.uni-bielefeld.de/gecko/,It allows for the systematic detection of gene cluster conservation in a large number of genomes. The enhancement over the original Gecko tool is the use of set-distance based gene cluster models that allow for the detection of gene clusters with diverse conservation patterns including gaps and missing genes in cluster occurrences.,Available for Download,,Pragya,
573,GEvolutionS,http://bibiserv.techfak.uni-bielefeld.de/gevolutions/,GEvolutions simulates a evolutionary genome rearragement szenario with different genome rearrangement operations. It operates on the most general model of genomes with a mixed collection on linear and circular chromosomes.,Available for Download,,Pragya,
574,DIALIGN,http://bibiserv2.cebitec.uni-bielefeld.de/dialign/,DIALIGN is a software program for multiple sequence alignment developed by Burkhard Morgensternet al..,Available for Download,,Pragya,
575,MGA: Multiple Genome Aligner,http://bibiserv.techfak.uni-bielefeld.de/mga/,"To allow a direct comparison of the genomic DNA sequences of sufficiently similar organisms, there is an urgent need for software tools that can align more than two genomic sequences",Available for Download,,Pragya,
