669,PLACE,http://www.dna.affrc.go.jp/PLACE/signalscan.html,"PLACE is a database of motifs found in plant cis-acting regulatory DNA elements, all from previously published reports. It covers vascular plants only.",Free Wb Service,,pragya,A Database of Plant Cis-acting Regulatory DNA Elements
670,rVista2.0,http://rvista.dcode.org/,High-throughput discovery of functional regulatory elements in sequence alignments. Excluding up to 95% false positive transcription factor binding sites predictions while maintaining high sensitivity of the search.,Free web service,,Pragya,
671,TESS,http://www.cbil.upenn.edu/tess?RQ=WELCOME,"TESS (Transcription Element Search System) is a web tool for predicting transcription factor binding sites in DNA sequences. It can identify binding sites using site or consensus strings and positional weight matrices from the TRANSFAC, JASPAR, IMD, and our CBIL-GibbsMat database. This resource is best for scanning short DNA sequences.","Free. Downoad, install and run.",,Pragya,
672,PlantTFDB,http://planttfdb.cbi.pku.edu.cn/index.php,"Plant Transcription Factor Database (Peking University, China) - provides search and Blast search capability.",Free.,,Pragya,
673,phiSITE - PromoterHunter,http://www.phisite.org/main/index.php?nav=tools&nav_sel=hunter,"is part of phiSITE database which is a collection of phage gene regulatory elements, genes, genomes and other related information, plus tools.",Free webservice,,Pragya,Tool for promoter search in prokryotic genomes.
674,phiSITE - Free Energy,http://www.phisite.org/main/index.php?nav=tools&nav_sel=free,The program for computation of Gibbs free energy distribution in DNA sequence,Free web service,,Pragya,
675,phiSITE - PSSM Convert,http://www.phisite.org/main/index.php?nav=tools&nav_sel=free,The program for PSSMs creation and for conversion of PSSM formats,Free Web Service,,Pragya,
676,Promoter Prediction by Neural Network,http://www.fruitfly.org/seq_tools/promoter.html,Neural Network Promoter Prediction,Free Web Service.,,Pragya,
677,BPROM,http://linux1.softberry.com/berry.phtml?topic=bprom&group=programs&subgroup=gfindb,Prediction of Bacterial Promoters,Free Web service.,,Pragya,
678,Promoter2.0 Prediction Server,http://www.cbs.dtu.dk/services/Promoter/,Promoter2.0 predicts transcription start sites of vertebrate PolII promoters in DNA sequences. It has been developed as an evolution of simulated transcription factors that interact with sequences in promoter regions. It builds on principles that are common to neural networks and genetic algorithms,Free web service,,Pragya,
679,PROMOSER,http://biowulf.bu.edu/zlab/PromoSer/,maps promoter sequences and transcription start sites in mammalian genomes.,Free web service,,Pragya,
680,TransTermHP,http://76.70.11.198/transterm/,"an online version of TranstermHP, Reference: Kingsford, C. et al. 2007. Genome Biol. 8: R22) an updated version of TransTerm (Reference:Ermolaeva, M.D. et al. 2000. J Mol Biol301:27-33)",Free Web Service,,Pragya,
681,NexABP,http://www.nature.com/srep/2013/130911/srep02634/full/srep02634.html,Next-generation sequencing (NGS) techniques have revolutionized genome analysis and consequently enhanced our understanding of genotype-phenotype relationships,Free Web Service,,KAPIL,
682,VILO,http://www.flintbox.com/public/project/23783/,"overcomes the shortcomings of malware, plagiarism & copyright infringement detection and offers a method for (a) finding commonalities or potentially derived portions of code, (b) measuring the similarity between programs according to these found portions of code, and (c) searching for matches against a database of programs, classifying a program based on an existing program classification scheme, or constructing program phylogenies based on either the identified derived portions of code, or on the similarity measures",Free Web Service,,KAPIL,
683,Pattern,http://linux1.softberry.com/berry.phtml?topic=pattern&group=programs&subgroup=promoter,Pattern search,Free web service,,Pragya,
684,EST_map,http://linux1.softberry.com/berry.phtml?topic=rnamap&group=programs&subgroup=scanh,Mapping your mRNA/EST to Chromosome sequence of Human genome,Free web service,,Pragya,Comparison of genomic and protein sequences
685,BLAST,http://linux1.softberry.com/berry.phtml?topic=blastall&group=programs&subgroup=scanh,Comparing your nucleotide sequence with Fgenesh++ set of mRNA/ORF,Free web service,,Pragya,Comparison of genomic and protein sequences
686,Gene tree,http://www.stats.ox.ac.uk/~griff/software.html,"The programs usually takes protein or nucleotide sequence alignments as input. In practice, to obtain a confident result, people usually try two or three approaches with different parameters, particularly, different substitution models.",Free web service,,kapil,
687,TransSeq,http://linux1.softberry.com/berry.phtml?topic=transseq&group=programs&subgroup=next-generation,TransSeq - Program for assembling transcripts from short reads (RNASeq data).,Free web service,,Pragya,
688,FoldRNA,http://linux1.softberry.com/berry.phtml?topic=foldrna&group=programs&subgroup=rnastruct,RNA secondary structure prediction through energy minimization,Free web service,,Pragya,
689,TargetMiRna,http://linux1.softberry.com/berry.phtml?topic=target_mirna&group=programs&subgroup=rnastruct,Search target for MiRNA,Free web service,,Pragya,
690,findMiRna,http://linux1.softberry.com/berry.phtml?topic=findmirna&group=programs&subgroup=rnastruct,program for search mirna,Free web service,,pragya,
691,ANI,http://enve-omics.ce.gatech.edu/ani/,"The ANI calculator estimates the average nucleotide identity using both best hits (one-way ANI) and reciprocal best hits (two-way ANI) between two genomic datasets, as calculated by Goris et al., 2007.",Free web service,,kapil,
692,FindTerm,http://linux1.softberry.com/berry.phtml?topic=findterm&group=programs&subgroup=gfindb,Finding Terminators in bacterial genomes,Free web service,,Pragya,
693,BESTPAL window,http://linux1.softberry.com/berry.phtml?topic=bestpal2_2&group=programs&subgroup=seqman,Calculates best palindrome for given rna sequence scanning the sequence with a window (for long sequences),Free web service,,Pragya,
694,BESTPAL helix,http://linux1.softberry.com/berry.phtml?topic=bestpal2_1&group=programs&subgroup=seqman,Calculates best palindrome for given rna sequence with restrictions,Free web service,,Pragya,
695,BESTPAL empirical,http://linux1.softberry.com/berry.phtml?topic=bestpal1&group=programs&subgroup=seqman,"Calculates best palindrome for given rna sequence, and also a set suboptimal palindromes (sorted by energy)",Free web service,,Pragya,
696,,,,Free web service,,,
697,MyTaxa,http://enve-omics.ce.gatech.edu/MyTaxa/submit,"represents a new algorithm that extends the Average Amino Acid Identity (AAI) concept to identify the taxonomic affiliation of a query genome sequence or a sequence of a contig assembled from a metagenome, including short sequences, and to classify sequences representing novel taxa at three levels i.e., species, genus and phylum. MyTaxa can assign a larger number of sequences and with higher accuracy compared to other tools available for the same purposes.",Free web service,,KAPIL,
698,AUGIST,http://www.lycaenid.org/augist/,AUGIST (accomodating uncertainty in genealogies while inferring species tress) is a new software package for inferring species trees while accommodating uncertainty in gene genealogies.,Free web service,,KAPIL,
699,BESTORF,http://linux1.softberry.com/berry.phtml?topic=bestorf&group=programs&subgroup=gfind,Finding potential coding fragment EST/mRNA,Free web service,,Pragya,
700,RNASPL,http://linux1.softberry.com/berry.phtml?topic=rnaspl&group=programs&subgroup=gfind,Search for exon-exon junction positions in Human cDNA,Free web service,,Pragya,
701,mirDeep2,https://www.mdc-berlin.de/8551903/en/research/research_teams/systems_biology_of_gene_regulatory_elements/projects/miRDeep,Discovering known and novel miRNAs from deep sequencing data,Free. Can be downloaded.,,Pragya,
702,PicTar,http://pictar.mdc-berlin.de/,PicTar is an algorithm for the identification of microRNA targets.,Algorithm can be used.,,Pragya,
703,doRiNA,http://dorina.mdc-berlin.de/,a database of RNA interactions in post-transcriptional regulation,Free,,Pragya,
704,madam,http://madam-db.sourceforge.net/,"Madam, the TIGR MicroArray Data Manager, is a database interface tool for microarray data.  Madam provides a database schema which is essential for its operation, and drivers for MySQL and Sybase.",Free web service,,kapil,
705,spotfinder,http://spotfinder.sourceforge.net/,"Spotfinder is an image processing software tool for microarray image analisys. It is written on C++ with QT GUI toolkit and runs on Windows, X11, and Mac OSX.",Free web service,,kapil,
706,miReduce,https://www.mdc-berlin.de/10615841/en/research/research_teams/systems_biology_of_gene_regulatory_elements/projects/mireduce,"miReduce correlates the logarithm of expression fold changes of a set of genes with the motif content of the regulatory sequences of these genes. In particular, it correlates the genome wide mRNA log fold changes in experiments involving the knockout/knockdown/overexpression of one or more miRNAs with the motif content of the 3'UTRs. The model is based on linear regression, and is intended for genome-wide studies.",Downloadable Package (Perl script),,Pragya,
707,SAVoR,http://tesla.pcbi.upenn.edu/savor/,SAVoR is an easy-to-use web application that allows the user to visualize RNA-seq data and other genomic annotations on RNA secondary structures. ,Free web service,,Pragya,
708,MIDAS,http://sourceforge.net/projects/midas-nms/files/,"MIDAS is a cross platform Monitoring and NIDS server. The goal of this project is to build a robust  and complete network/system monitoring suite that is capable of scaling to very large networks.
      ",Free web service,,KAPIL,
709,MeV,http://sourceforge.net/projects/mev-tm4/,"MeV (Multiple Experiment Viewer) is a Java tool for genomic data analysis. MeV supports many different input formats, and provides an
intuitive graphical interface for clustering, classification, statistical analysis and theme discovery.",Free web service,,KAPIL,
710,"Charting Companion 5
",http://progenygenealogy.com/downloads/all-products-and-trials.aspx,you can create beautiful-looking family tree charts! Share your research with friends & relatives.,paid,,KAPIL,
711,The Social Security Death Index,http://progenygenealogy.com/downloads/all-products-and-trials.aspx,"With over 61 million records on a single CD, the Social Security Death
Index is a perfect starting point for your family history research.
Because of the sheer size of the database, chances are good that you'll
find one or more of your ancestors here.",paid,,KAPIL,
712,Genelines Universal,http://progenygenealogy.com/downloads/all-products-and-trials.aspx,"you can create seven customizable timeline charts that read files
directly from many popular genealogy software databases – without
exporting to GEDCOM. ",paid,,KAPIL,
713,jViz.Rna,http://jviz.cs.sfu.ca/,jViz.Rna 2.0 is a multi-platform visualization tool capable of displaying and comparing RNA secondary structures encoded in a number of file formats. A Java application for visualizing and annotating RNA Secondary Structures,Free. Available for download,,Pragya,
714,4SALE,http://4sale.bioapps.biozentrum.uni-wuerzburg.de/index.html,A tool for Synchronous RNA Sequence and Secondary Structure Alignment and Editing,Free. Available for download,,Pragya,
715,"ConStruct
",http://www.biophys.uni-duesseldorf.de/construct3/,"Multipurpose tool for alignment editing, secondary structure prediction and visualizing RNA alignments (new version).",Free. Available for download,,Pragya,
716,RootsWeb,http://www.rootsweb.ancestry.com/,The primary purpose and function of RootsWeb.com is to connect people so that they can help each other and share genealogical research. Most resources on RootsWeb.com are designed to facilitate such connections.,free,,KAPIL,
717,,,,,,,
718,loopDloop,http://iubio.bio.indiana.edu/IUBio-Software+Data/molbio/loopdloop/java/loopDloop-doc.html,loopDloop is a tool for drawing RNA secondary structures in molecular biology.,Free. Available for download.,,Pragya,
719,Cyber-T,http://cybert.microarray.ics.uci.edu/,"Cyber-T provides differential analysis tools for high-throughput data. The system handles many types of data, from DNA and Protein microarrays, to Next Generation Sequencing, to Quantitative Mass Spectrometry.",Free. Web service. Also available for download.,,Pragya,
720,NIA Array Analysis,http://lgsun.grc.nia.nih.gov/ANOVA/,"for microarray data analysis, which features the false discovery rate for testing statistical significance and the principal component analysis using the singular value decomposition method for detecting the global trends of gene-expression patterns.",Free web service.,,Pragya,
721,Mouse mRNA Degradation Rates,http://lgsun.grc.nia.nih.gov/mRNA/,Database of mRNA degradation rates in mouse ES cells,Free web service.,,Pragya,
722,M@CBETH,http://tomcat.esat.kuleuven.be/MACBETH/,Welcome to the M@CBETH web service for performing microarray classification. The M@CBETH (a MicroArray Classification BEnchmarking Tool on a Host server) web service offers the microarray community a simple tool for making optimal two-class predictions.,Web Service. Also available for download.,,Pragya,
723,MAGIC Tool,http://www.bio.davidson.edu/projects/MAGIC/MAGIC.html,MicroArray Genome Imaging & Clustering Tool,Free. Available for download.,,Pragya,
724,MLSTest,http://www.mlst.net/default.asp,"Multiple FASTA sequences can be loaded simultaneously. The user can view
 the alignment/polymorphic sites/codons and/or amino acids
interchangeably. Multiple options to modify, concatenate and export
alignments into different file formats are available",free,,kapil,
725,VAMPIRE,http://sasquatch.ucsd.edu/vampire/,microarray analysis suite - is a statistical framework that models the dependence of measurement variance on the level of gene expression in the context of a Bayesian hierarchical model.,Free. Can be used after registration.,,Pragya,
726,iGEMS,http://genomics10.bu.edu/terrence/gems/,Gene Expression Mining Server - simple but promising new approach for biclustering based on a Gibbs sampling paradigm.,Free Web Service.,,Pragya,
727,RNA-ensign,http://www.mybiosoftware.com/rna-analysis/12897,RNA-ensign is a program for designing RNA sequences folding into target secondary structures.,Free. Available for download.,,Pragya,
728,RactIP,https://code.google.com/p/ractip/downloads/list,Fast and accurate prediction of RNA-RNA interaction using integer programming.,Free. Available for download.,,Pragya,
729,4273π,http://eggg.st-andrews.ac.uk/4273pi/,"customized distribution of Raspbian GNU/Linux for the Raspberry Pi computer. 4273π is for those wishing to teach, learn or use bioinformatics on the Raspberry Pi. 4273π includes 4273π Bioinformatics for Biologists, an Open Access bioinformatics course",Free. Available for download.,,kapil,
730,bms_runner,http://eggg.st-andrews.ac.uk/bms_runner/,"bms_runner is a free script written by Daniel Barker and Mark Pagel. bms_runner uses the separate program BayesTraits to predict functional links among genes, on the basis of correlated gain and loss of genes from species’ genomes.",Free. Available for download.,,kapil,
731,FLRTFM,http://eggg.st-andrews.ac.uk/flrtfm/,FLRTFM (“Firth Logistic Regression Transcription Factor Models”) is a free script written by Ji-Hyun Lim. FLRTFM uses combined sequence and histone modification data to predict transcription factor binding sites.,Free. Available for download.,,kapil,
732,LVB,http://eggg.st-andrews.ac.uk/lvb/,"LVB is a free computer program written by Daniel Barker
 and Maximilian Strobl at the University of St Andrews. LVB uses
parsimony to reconstruct phylogeny from a nucleotide multiple alignment,
 using a simulated annealing heuristic search. This is suitable for
moderately large data matrices.",Free. Available for download.,,kapil,
733,patquest,http://eggg.st-andrews.ac.uk/software/,Genetic marker based inference of paternity and impacts of paternal traits on reproductive success,Free. Available for download.,,kapil,
734,simpops.mac,http://eggg.st-andrews.ac.uk/simpops-mac/,"simpops.mac is a free script written by Daniel Barker and Richard Sibly.
 simpops.mac uses the theta-logistic model of population regulation to
simulate observed population time series, with environmental
perturbation and measurement error.",Free. Available for download.,,kapil,
735,NGS-resources,http://genome.ucsc.edu/goldenPath,"Genome Browser in a Box (GBiB) is a small virtual machine version of the
 popular University of California Santa Cruz (UCSC) Genome Browser that
can be run on a researcher's own computer. Once GBiB is installed, a
standard web browser is used to access the virtual server and add
personal data files from the local hard disk. Annotation data are loaded
 on demand through the Internet from UCSC or can be downloaded to the
local computer for faster access.",paid,,kapil,
736,SVAMP,http://researchonline.lshtm.ac.uk/1673630/,"SVAMP is a stand-alone desktop application to visualize genomic variants
 (in variant call format) in the context of geographical metadata. Users
 of SVAMP are able to generate phylogenetic trees and perform principal
coordinate analysis in real time from variant call format (VCF) and
associated metadata files. ",FREE,,kapil,
737,jRNA,http://misc.speciesfile.org/rna/methods_automated.php,"A major goal is to produce a multiple sequence alignment (i.e.
series of homology statements) that agrees well with a known secondary
structure, using time-saving algorithms/programs and sacrificing as
little precision as possible.  While motif finding software does this in
 to some degree, their underlying goals are not always the phylogenetic
analysis of the end result, for example they may sacrifice
pattern-finding utility for confidence in homology, or the output may
not formated in a manner useable by tree-reconstruction utilities",FREE,,kapil,
738,phase2nexus.pl,http://misc.speciesfile.org/rna/download.php,"Converts PHASE tree output to a PAUP treefile.  The file does not
include a taxa or data block, these blocks must be loaded from a PAUP
datafile (use Jrna to make a nexus file with the same partitions and
execute this file first).  Executing the file output by the script in
PAUP generates a majority rule consensus tree which is automatically
saved to the file 'phase_consensus.tre'.  This result is then comparable
 to results generated in MrBayes.",FREE,,kapil,
739,phase2tracer.pl,http://misc.speciesfile.org/rna/download.php,"Loads PHASE 1.1 output files and returns a file of samples file similar to that generated by MrBayes.  This file can be loaded into Tracer, a handy program of use in examening parameter convergence.
",FREE,,kapil,
740,phy2flat.pl,http://misc.speciesfile.org/rna/download.php,Perl script converts interleaved Phylip formatted files to a single large interleave.,FREE,,kapil,
741,Clustal,http://misc.speciesfile.org/rna/methods_automated.php,"Clustal can be used to align sequences to an existing alignment, and can use a mask statement.",FREE,,kapil,
742,BRaliBase III,http://misc.speciesfile.org/rna/methods_automated.php,Cutting edge. Uses a scripted approach to tie together a number of new and existing software,FREE,,kapil,
743,HMMER,http://misc.speciesfile.org/rna/methods_automated.php,"While hmmer does not take into account secondary structure information
per se, training the hmmer model with an existing secondary-structure
based alignment is an effective way to estimate a first pass at the
structure of unaligned sequences. ",FREE,,kapil,
744,Infernal,http://misc.speciesfile.org/rna/methods_automated.php,"Practically, it functions much like HMMER, but this program takes into account covariance information.",FREE,,kapil,
745,BAli-Phy,http://misc.speciesfile.org/rna/methods_automated.php,Bayesian multiple alignment.  ,FREE,,kapil,
746,MARNA,http://misc.speciesfile.org/rna/methods_automated.php,"""The max. sequence length should not exceed 500 nt. The number of sequences depends on sequence lengths. The total sum of all sequence lengths is restricted to 10000 nt, e.g., you can paste 20 sequences with lengths of 500 nt each, or 100 sequences with lengths of 100 nt, each.""",FREE,,kapil,
747,comRNA,http://misc.speciesfile.org/rna/methods_automated.php," ""comRNA ... predicts common RNA secondary structure motifs in a group
of related sequences, developed by Yongmei Ji, Xing Xu and Gary Stormo
at Washington University in Saint Louis.""",FREE,,kapil,
748, GUIDANCE web server:,http://privman.haifa.ac.il/index.php/software," estimation
 of confidence scores for individual alignment positions or individual
residues, and filtering or masking of these unreliable positions to
reduce errors in downstream analyses such as positive selection
inference (dN/dS methods).",FREE,,kapil,
749, HomeBase web server,http://privman.haifa.ac.il/index.php/software,a searchable collection of homing endonucleases and their predicted target sequences for gene targeting applications.,FREE,,kapil,
750,SEMPHY package.,http://privman.haifa.ac.il/index.php/software,"Phylogeny
 reconstruction: improved accuracy of pairwise distance estimation for
neighbor joining and other distance-based phylogeny reconstruction
methods - available as part of the",FREE,,kapil,
751,FastMG,http://fastmg.codeplex.com/,"a simple, fast, and accurate maximum likelihood procedure to estimate amino acid replacement rate matrices from large data sets",FREE,,kapil,
752,BION2SEL,http://link.springer.com/chapter/10.1007/978-3-319-12418-6_11,An Ontology-based Approach for the Selection of Molecular Biology Databases,FREE,,kapil,
753,Biopieces,https://code.google.com/p/biopieces/,"a next generation sequencing experiment can be cleaned and analyzed – including plotting of scores and length distribution, removal of adaptor sequence, trimming and filtering using quality scores, mapping to a specified genome, and uploading the data to the UCSC genome browser for further analysis",FREE,,Pragya,Quality Control and Filtering Data
754,BBMap,http://sourceforge.net/projects/bbmap/,"Ultrafast, multithreaded tool to trim adapters and filter or mask contaminants based on kmer-matching, allowing a hamming- or edit-distance, as well as degenerate bases.",FREE and Open source,,Pragya,Quality Control and Filtering Data
755,Cutadapt,https://code.google.com/p/cutadapt/,"removes adapter sequences from next-generation sequencing data (Illumina, SOLiD and 454). It is used especially when the read length of the sequencing machine is longer than the sequenced molecule, like the microRNA case.",FREE,,Pragya,Quality Control and Filtering Data
756,Codetri,https://code.google.com/p/condetri/,"ConDeTri, a method for content dependent read trimming for Illumina data using quality scores of each base individually.",FREE,,Pragya,Quality Control and Filtering Data
757,seq_crumbs,http://bioinf.comav.upv.es/seq_crumbs/,a collection of small sequence processing utilities,FREE,,Pragya,Quality Control and Filtering Data
758,FASTX Toolkit,http://hannonlab.cshl.edu/fastx_toolkit/,"a collection of command line tools for Short-Reads FASTA/FASTQ files preprocessing. Next-Generation sequencing machines usually produce FASTA or FASTQ files, containing multiple short-reads sequences (possibly with quality information). It is better to preprocess these files before use.",FREE,,Pragya,Quality Control and Filtering Data
759,DeconSeq,http://deconseq.sourceforge.net/,Detect and remove contaminations from your sequence data,free,,Pragya,Quality Control and Filtering Data
760,FastQC,http://www.bioinformatics.babraham.ac.uk/projects/fastqc/,A quality control tool for high throughput sequence data.,free,,Pragya,Quality Control and Filtering Data
761,FastqMcf,https://code.google.com/p/ea-utils/wiki/FastqMcf,"Used to-Detect & remove sequencing adapters and primers
Detect limited skewing at the ends of reads and clip
Detect poor quality at the ends of reads and clip
Detect Ns, and remove from ends
Remove reads with CASAVA 'Y' flag (purity filtering)
Discard sequences that are too short after all of the above
Keep multiple mate-reads in sync while doing all of the above",free (souce available),,Pragya,Quality Control and Filtering Data
762,Flexbar,http://sourceforge.net/projects/flexbar/,Flexbar preprocesses high-throughput sequencing data efficiently. It demultiplexes barcoded runs and removes adapter sequences.,free,,Pragya,Quality Control and Filtering Data
763,FreClu,http://mlab.cb.k.u-tokyo.ac.jp/~quwei/DeNovoShortReadClustering/,"improves overall alignment accuracy performing sequencing-error correction by trimming short reads, based on a clustering methodology.",free,,Pragya,Quality Control and Filtering Data
764,HTSeq,http://www-huber.embl.de/users/anders/HTSeq/doc/qa.html#qa,The Python script htseq-qa takes a file with sequencing reads (either raw or aligned reads) and produces a PDF file with useful plots to assess the technical quality of a run.,free,,Pragya,Quality Control and Filtering Data
765,htSeqTools,http://www.bioconductor.org/packages/2.9/bioc/html/htSeqTools.html,"a Bioconductor package able to perform quality control, processing of data and visualization. htSeqTools makes possible visualize sample correlations, to remove over-amplification artifacts, to assess enrichment efficiency, to correct strand bias and visualize hits.",free,,Pragya,Quality Control and Filtering Data
